{
  "stream": true,
  "temperature": 0.7,
  "max_parallel_calls": 8,
  "default_org": "solo",
  "user_context": {
    "enabled": true,
    "path": "user_context/my_context.md",
    "max_chars": 8000,
    "rag": {
      "enabled": false,
      "corpus_dir": "user_context/corpus",
      "index_dir": "user_context/index",
      "top_k": 5
    }
  },
  "upload_limits": {
    "max_files": 5,
    "max_file_size_kb": 256,
    "max_total_chars": 80000
  }
}
